{
  "schema_version": 1,
  "domain": "public-code-verification",
  "result_ref": "rr-20260926-0001-fictitious",
  "state": "LEGIT_CIRCULATION",
  "reasons": [
    "manufacturer_record_found",
    "manufacturer_qualified",
    "chain_continuous",
    "legal_chain_latest"
  ],
  "rule_version": 3,
  "data_as_of": "2026-09-26T08:00:00+08:00",
  "data_epoch": 58211,
  "generated_at": "2026-09-26T08:05:12+08:00",
  "code_ref": {
    "code_hash": "hmacsha256fictitious00000000000000000000000000a1b2c3"
  },
  "product": {
    "generic_name": "虚构示例：阿莫西林胶囊",
    "batch_id": "FX260801",
    "produced_on": "2026-08-02"
  },
  "trail": [
    {
      "node_type": "MANUFACTURER",
      "region": "浙江省",
      "at": "2026-08-05",
      "summary": "生产记录与主体资质有效"
    },
    {
      "node_type": "WHOLESALE",
      "region": "江苏省",
      "at": "2026-08-20"
    },
    {
      "node_type": "RETAIL",
      "region": "上海市",
      "at": "2026-09-10"
    }
  ],
  "subscription": {
    "subscribed": false,
    "subscribe_path": "/v1/subscriptions"
  }
}
