{
  "schema_version": 1,
  "domain": "public-code-verification",
  "result_ref": "rr-20260926-0003-fictitious",
  "state": "PENDING_REVIEW",
  "reasons": [
    "chain_gap_detected",
    "scan_geo_anomaly"
  ],
  "rule_version": 3,
  "data_as_of": "2026-09-26T08:00:00+08:00",
  "data_epoch": 58211,
  "generated_at": "2026-09-26T08:06:40+08:00",
  "code_ref": {
    "code_hash": "hmacsha256fictitious00000000000000000000000000778899"
  },
  "product": {
    "generic_name": "虚构示例：头孢克肟颗粒",
    "batch_id": "FX260901",
    "produced_on": "2026-09-02"
  },
  "trail": [
    {
      "node_type": "MANUFACTURER",
      "region": "山东省",
      "at": "2026-09-03"
    }
  ],
  "action": {
    "guidance_ref": "虚构指引G-REVIEW-01",
    "instruction_code": "WAIT_REVIEW"
  },
  "subscription": {
    "subscribed": true
  }
}
