{
  "schema_version": 1,
  "domain": "public-code-verification",
  "result_ref": "rr-20260926-0002-fictitious",
  "state": "RECALLED",
  "reasons": [
    "manufacturer_record_found",
    "recall_active"
  ],
  "rule_version": 3,
  "data_as_of": "2026-09-26T07:30:00+08:00",
  "data_epoch": 58209,
  "generated_at": "2026-09-26T07:31:04+08:00",
  "code_ref": {
    "code_hash": "hmacsha256fictitious00000000000000000000000000d4e5f6"
  },
  "product": {
    "generic_name": "虚构示例：布洛芬片",
    "batch_id": "FX260715",
    "produced_on": "2026-07-16"
  },
  "trail": [
    {
      "node_type": "MANUFACTURER",
      "region": "广东省",
      "at": "2026-07-18"
    },
    {
      "node_type": "RECALL",
      "region": "全国",
      "at": "2026-09-25",
      "summary": "批次召回生效中"
    }
  ],
  "notice_ref": "虚构药监公告2026-0042",
  "action": {
    "guidance_ref": "虚构指引G-2026-0042",
    "instruction_code": "STOP_USE_AND_RETURN"
  },
  "subscription": {
    "subscribed": false,
    "subscribe_path": "/v1/subscriptions"
  }
}
